{"url": "https://olinda.bcb.gov.br/olinda/servico/PTAX/versao/v1/odata/CotacaoMoedaPeriodo(moeda=@moeda,dataInicial=@dataInicial,dataFinalCotacao=@dataFinalCotacao)?@moeda=%27AUD%27&@dataInicial=%27{from}%27&@dataFinalCotacao=%27{to}%27&$format=json", "http_method": "GET", "params": "[{\"type\": \"period\", \"unit\": \"day\", \"format\": \"%m-%d-%Y\", \"start_date\": {\"variable\": \"from\", \"value\": \"current - 1\"}, \"end_date\": {\"variable\": \"to\", \"value\": \"current + 1\"}}]", "headers": "{\"Content-Type\": \"text/json\"}"}
